{"$schema":"https://json-schema.org/draft/2020-12/schema","$id":"https://devsembly.local/schemas/organizational-genome/position.schema.json","title":"Canonical Position Specification","type":"object","required":["position_id","version","title","mission","organizational_unit_id","job_family","capability_grade","lifecycle_status","authority_profile_id","memory_profile_id","training_profile_id","source_provenance"],"properties":{"position_id":{"type":"string","pattern":"^[A-Z0-9][A-Z0-9-]{2,63}$"},"version":{"type":"string","pattern":"^[0-9]+\\.[0-9]+\\.[0-9]+$"},"title":{"type":"string","minLength":1},"mission":{"type":"string","minLength":1},"organizational_unit_id":{"type":"string"},"reports_to_position_id":{"type":["string","null"]},"job_family":{"type":"string"},"occupation_codes":{"type":"array","items":{"type":"string"}},"capability_grade":{"type":"string","enum":["A0","A1","A2","A3","A4","A5","A6","A7","A8"]},"lifecycle_status":{"type":"string","enum":["draft","review","approved","active","deprecated","retired"]},"effective_date":{"type":"string","format":"date"},"superseded_by":{"type":["string","null"]},"responsibilities":{"type":"array","items":{"type":"string"}},"duties":{"type":"array","items":{"type":"string"}},"recurring_tasks":{"type":"array","items":{"type":"string"}},"required_skills":{"type":"array","items":{"type":"string"}},"required_knowledge":{"type":"array","items":{"type":"string"}},"competencies":{"type":"array","items":{"type":"string"}},"tools":{"type":"array","items":{"type":"string"}},"policies":{"type":"array","items":{"type":"string"}},"workflows":{"type":"array","items":{"type":"string"}},"kpis":{"type":"array","items":{"type":"string"}},"authority_profile_id":{"type":"string"},"memory_profile_id":{"type":"string"},"training_profile_id":{"type":"string"},"source_provenance":{"type":"array","minItems":1,"items":{"type":"string"}},"tenant_overlay_allowed":{"type":"boolean","default":true}},"additionalProperties":false}